<?xml version="1.0" encoding="UTF-8"?>
<!DOCTYPE SCENARIO SYSTEM "multiModelTrafficSimulatorInput.dtd">
<SCENARIO>
	<VEHICLES>
		<VEHICLE label="IDM1" length="6" b_max="9">
			<LONGITUDINAL_MODEL>
				<IDM v0="33.33" T="1" s0="2" s1="0" delta="4" a="1.0" b="1.5"/>
			</LONGITUDINAL_MODEL>
			<LANE_CHANGE_MODEL/>
		</VEHICLE>
	</VEHICLES>
	<SIMULATION dt="0.5" duration="7200" seed="42">
		<ROAD id="1" length="20000" lanes="1">
			<TRAFFIC_COMPOSITION write_fund_diagrams="false">
				<VEHICLE_TYPE label="IDM1" fraction="1"/>
			</TRAFFIC_COMPOSITION>
			<INITIAL_CONDITIONS />
			<TRAFFIC_SOURCE logging="false">
				<INFLOW t="0" q_per_hour="2000" v="30"/>
			</TRAFFIC_SOURCE>
			<TRAFFIC_SINK />
			<FLOW_CONSERVING_INHOMOGENEITIES />
			<SPEED_LIMITS />
			<RAMPS>
				<RAMP x="15000" length="1000" logging="true">
					<INFLOW t="0" q_per_hour="500"/>
				</RAMP>
			</RAMPS>
			<TRAFFIC_LIGHTS />
			<OUTPUT>
				<SPATIOTEMPORAL dx="100" dt="60"/>
				<DETECTORS dt="60">
					<CROSS_SECTION x="1000"/>
					<CROSS_SECTION x="6000"/>
					<CROSS_SECTION x="8000"/>
					<CROSS_SECTION x="9000"/>
					<CROSS_SECTION x="10000"/>
					<CROSS_SECTION x="11000"/>
					<CROSS_SECTION x="12000"/>
					<CROSS_SECTION x="13000"/>
					<CROSS_SECTION x="14000"/>
					<CROSS_SECTION x="15000"/>
					<CROSS_SECTION x="16000"/>
				</DETECTORS>
			</OUTPUT>
		</ROAD>
	</SIMULATION>
</SCENARIO>
