<?xml version="1.0" encoding="UTF-8"?>
<!DOCTYPE SCENARIO SYSTEM "multiModelTrafficSimulatorInput.dtd">

<!-- (c) Movsim, Arne Kesting 2012 -->
<SCENARIO network_filename="startStop_all_iteratedmaps.xodr">
    <VEHICLES write_fund_diagrams="false">
    <VEHICLE label="GIPPS1" length="8" b_max="20">
            <LONGITUDINAL_MODEL>
                <GIPPS v0="15" a="1.5" b="1.0" s0="2" />
            </LONGITUDINAL_MODEL>
            <LANE_CHANGE_MODEL />
        </VEHICLE>
        <VEHICLE label="KRAUSS1" length="8" b_max="20">
            <LONGITUDINAL_MODEL>
                <KRAUSS v0="15" a="1.0" b="1.0" s0="2" epsilon="0.4" />
            </LONGITUDINAL_MODEL>
            <LANE_CHANGE_MODEL />
        </VEHICLE>
        <VEHICLE label="NEWELL1" length="8" b_max="9">
            <LONGITUDINAL_MODEL>
                <NEWELL v0="15" s0="2" />
            </LONGITUDINAL_MODEL>
            <LANE_CHANGE_MODEL />
        </VEHICLE>
        <VEHICLE label="Obstacle" length="8" b_max="20">
            <LONGITUDINAL_MODEL>
                <GIPPS v0="0" a="1.5" b="1.0" s0="2" />
            </LONGITUDINAL_MODEL>
            <LANE_CHANGE_MODEL />
        </VEHICLE>
    </VEHICLES>
    <SIMULATION dt="0.2" duration="360" fixed_seed="true" seed="42" crash_exit="false">
        <TRAFFIC_COMPOSITION>
            <VEHICLE_TYPE label="GIPPS1" fraction="1" />
        </TRAFFIC_COMPOSITION>
                <!-- ############################ -->
        <ROAD id="GIPPS">
          <TRAFFIC_COMPOSITION>
            <VEHICLE_TYPE label="GIPPS1" fraction="1" />
           <VEHICLE_TYPE label="Obstacle" fraction="0" /> 
        </TRAFFIC_COMPOSITION>
            <INITIAL_CONDITIONS>
                <IC_MICRO x="10" v="0" />
                <IC_MICRO x="20" v="0" />
                <IC_MICRO x="30" v="0" />
                <IC_MICRO x="40" v="0" />
                <IC_MICRO x="50" v="0" />
                <IC_MICRO x="60" v="0" />
                <IC_MICRO x="70" v="0" />
                <IC_MICRO x="80" v="0" />
                <IC_MICRO x="90" v="0" />
                <IC_MICRO x="100" v="0" />
                <IC_MICRO x="110" v="0" />
                <IC_MICRO x="120" v="0" />
                <IC_MICRO x="130" v="0" />
                <IC_MICRO x="140" v="0" />
                <IC_MICRO x="150" v="0" />
                <IC_MICRO x="160" v="0" />
                <IC_MICRO x="170" v="0" />
                <IC_MICRO x="180" v="0" />
                <IC_MICRO x="190" v="0" />
                <IC_MICRO x="200" v="0" />
                <IC_MICRO x="210" v="0" />
                <IC_MICRO x="220" v="0" />
                <IC_MICRO x="230" v="0" />
                <IC_MICRO x="240" v="0" />
                <IC_MICRO x="250" v="0" />
                <IC_MICRO x="260" v="0" />
                <!-- obstacle shifts floating car numbers -->
                <IC_MICRO x="2000" v="0" label="Obstacle" />
            </INITIAL_CONDITIONS>
                 </ROAD>
                                 <!-- ############################ -->
                         <ROAD id="KRAUSS">
                          <TRAFFIC_COMPOSITION>
            <VEHICLE_TYPE label="KRAUSS1" fraction="1" />
           <VEHICLE_TYPE label="Obstacle" fraction="0" /> 
        </TRAFFIC_COMPOSITION>
                          <INITIAL_CONDITIONS>
                <IC_MICRO x="10" v="0" />
                <IC_MICRO x="20" v="0" />
                <IC_MICRO x="30" v="0" />
                <IC_MICRO x="40" v="0" />
                <IC_MICRO x="50" v="0" />
                <IC_MICRO x="60" v="0" />
                <IC_MICRO x="70" v="0" />
                <IC_MICRO x="80" v="0" />
                <IC_MICRO x="90" v="0" />
                <IC_MICRO x="100" v="0" />
                <IC_MICRO x="110" v="0" />
                <IC_MICRO x="120" v="0" />
                <IC_MICRO x="130" v="0" />
                <IC_MICRO x="140" v="0" />
                <IC_MICRO x="150" v="0" />
                <IC_MICRO x="160" v="0" />
                <IC_MICRO x="170" v="0" />
                <IC_MICRO x="180" v="0" />
                <IC_MICRO x="190" v="0" />
                <IC_MICRO x="200" v="0" />
                <IC_MICRO x="210" v="0" />
                <IC_MICRO x="220" v="0" />
                <IC_MICRO x="230" v="0" />
                <IC_MICRO x="240" v="0" />
                <IC_MICRO x="250" v="0" />
                <IC_MICRO x="260" v="0" />
                <!-- obstacle shifts floating car numbers -->
                <IC_MICRO x="2000" v="0" label="Obstacle" />
            </INITIAL_CONDITIONS>
                 </ROAD>
                 
                 
            
        <ROAD id="NEWELL">
               <TRAFFIC_COMPOSITION>
            <VEHICLE_TYPE label="NEWELL1" fraction="1" />
            <VEHICLE_TYPE label="Obstacle" fraction="0" />
        </TRAFFIC_COMPOSITION>
            <INITIAL_CONDITIONS>
                <IC_MICRO x="10" v="0" />
                <IC_MICRO x="20" v="0" />
                <IC_MICRO x="30" v="0" />
                <IC_MICRO x="40" v="0" />
                <IC_MICRO x="50" v="0" />
                <IC_MICRO x="60" v="0" />
                <IC_MICRO x="70" v="0" />
                <IC_MICRO x="80" v="0" />
                <IC_MICRO x="90" v="0" />
                <IC_MICRO x="100" v="0" />
                <IC_MICRO x="110" v="0" />
                <IC_MICRO x="120" v="0" />
                <IC_MICRO x="130" v="0" />
                <IC_MICRO x="140" v="0" />
                <IC_MICRO x="150" v="0" />
                <IC_MICRO x="160" v="0" />
                <IC_MICRO x="170" v="0" />
                <IC_MICRO x="180" v="0" />
                <IC_MICRO x="190" v="0" />
                <IC_MICRO x="200" v="0" />
                <IC_MICRO x="210" v="0" />
                <IC_MICRO x="220" v="0" />
                <IC_MICRO x="230" v="0" />
                <IC_MICRO x="240" v="0" />
                <IC_MICRO x="250" v="0" />
                <IC_MICRO x="260" v="0" />
                <!-- obstacle shifts floating car numbers -->
                <IC_MICRO x="2000" v="0" label="Obstacle" />
            </INITIAL_CONDITIONS>
        </ROAD>
        <OUTPUT />
    </SIMULATION>
</SCENARIO>

