<?xml version="1.0" encoding="UTF-8"?>
<!DOCTYPE SCENARIO SYSTEM "sim/multiModelTrafficSimulatorInput.dtd">


<!-- (c) Martin Treiber, Arne Kesting 2010      -->

<SCENARIO>

<DRIVER_VEHICLE_UNITS>

  <VEHICLE label="IDM1" length="8" b_max="9"> 
    <LONGITUDINAL_MODEL>
       <IDM v0="25" T="1" s0="2" s1="0" delta="4" a="1.0" b="1.5" />
    </LONGITUDINAL_MODEL>
    <LANE_CHANGING_MODEL/>
  </VEHICLE>
</DRIVER_VEHICLE_UNITS>



<OUTPUT>
  <FLOATING_CAR_DATA n_dt="5" perc_out="0" dn="0">
     <FC number="1" />
     <FC number="4" />
     <FC number="8" />
     <FC number="12" />
     <FC number="16" />
     <FC number="20" />
     <FC number="24" />
	 <FC number="28" />
	 <FC number="32" />
	 <FC number="36" />
	 <FC number="40" />

  </FLOATING_CAR_DATA>
  <TRAFFICLIGHT_RECORDER n_dt="5"  /> <!-- for testing -->
</OUTPUT>

<SIMULATION dt="0.2" x_max="1500" t_max="400" lanes="1" with_fixed_seed="true" seed="42">

  <HETEROGENEITY write_fund_diagrams="true" >
    <VEHICLE_TYPE label="IDM1" fraction="1"  />
  </HETEROGENEITY>
  
  <INITIAL_CONDITIONS>
   <IC_MICRO x="10"  v="0" />  
  <IC_MICRO x="20"  v="0" />
  <IC_MICRO x="30"  v="0" />
  <IC_MICRO x="40"  v="0" />
  <IC_MICRO x="50"  v="0" />
  <IC_MICRO x="60"  v="0" />
  <IC_MICRO x="70"  v="0" />
  <IC_MICRO x="80"  v="0" />
  <IC_MICRO x="90"  v="0" />
  <IC_MICRO x="100" v="0" />
  <IC_MICRO x="110" v="0" />
  <IC_MICRO x="120" v="0" />
  <IC_MICRO x="130" v="0" />
  <IC_MICRO x="140" v="0" />
  <IC_MICRO x="150" v="0" />
  <IC_MICRO x="160" v="0" />
  <IC_MICRO x="170" v="0" />
  <IC_MICRO x="180" v="0" />
  <IC_MICRO x="190" v="0" />
  <IC_MICRO x="200" v="0" />
  <IC_MICRO x="220" v="0" />
  <IC_MICRO x="240" v="0" />
  <IC_MICRO x="260" v="0" />
  </INITIAL_CONDITIONS>


  <UPSTREAM_BOUNDARY_CONDITIONS>
    <INFLOW t="0"  q_invh="300"   v="30" />
  </UPSTREAM_BOUNDARY_CONDITIONS>

  <FLOW_CONSERVING_INHOMOGENEITIES>
  </FLOW_CONSERVING_INHOMOGENEITIES>
  

  <SPEED_LIMITS>
  </SPEED_LIMITS>

  <RAMPS>
  </RAMPS>

  <TRAFFICLIGHTS>
     <TRAFFICLIGHT x="700" green_time="30" green_red_time="3" red_time="45" red_green_time="2" phase_shift="0" /> 
	 <TRAFFICLIGHT x="1200" green_time="15" green_red_time="3" red_time="45" red_green_time="2" phase_shift="10" /> 
  </TRAFFICLIGHTS>

</SIMULATION>

</SCENARIO>

